{
  "schema": "nikami-fnv-save330-retail-visual-reference/v1",
  "status": "fixed",
  "saveSha256": "07dbdd2d7c4abe3160628e5463a9603a40f4271042c1da1b89f1c4a4f7dbd81f",
  "save": {
    "path": "C:/Users/nbrys/OneDrive/Documents/My Games/FalloutNV/Saves/Save 330     Goodsprings  00 16 45.fos",
    "bytes": 3395328,
    "sha256": "07dbdd2d7c4abe3160628e5463a9603a40f4271042c1da1b89f1c4a4f7dbd81f"
  },
  "image": {
    "path": "retail-save330-reference.png",
    "bytes": 317441,
    "sha256": "859fa4a89d0cc5efb16693a0aa104c264a1f9bc6c0bb257706b5401ceb8fd008",
    "width": 512,
    "height": 320,
    "pixelFormat": "rgb24",
    "saveOffset": 147,
    "saveBytes": 491520
  },
  "playerReference": {
    "metadataStatus": "partial",
    "actorReferenceFormId": "0x00000014",
    "baseNpcFormId": "0x00000007",
    "changeFlags": "0xB0000022",
    "worldspace": {
      "formId": "0x000DA726",
      "recordType": "WRLD",
      "editorId": "WastelandNV",
      "name": "Mojave Wasteland",
      "sourcePlugin": {
        "path": "D:/SteamLibrary/steamapps/common/Fallout New Vegas/Data/FalloutNV.esm",
        "bytes": 245650747,
        "sha256": "50991d36804b7d1e70df1afd7471b72f0e29d1b456ee2516a9717c002564e7c1"
      }
    },
    "position": [-72392.84375, -1240.19275, 8137.58643],
    "rotationRadians": [-0.0643904507, -0.0, 2.93332028],
    "saveRanges": {
      "movementPrefix": { "offset": 497489, "bytes": 28 },
      "worldspaceRefId": { "offset": 497489, "bytes": 3, "encoded": "0x000247", "formIdArrayOneBasedIndex": 583 },
      "position": { "offset": 497492, "bytes": 12 },
      "rotationRadians": { "offset": 497504, "bytes": 12 },
      "terminator": { "offset": 497516, "bytes": 1, "value": "0x7C" },
      "opaqueRemainder": { "offset": 497517, "bytes": 5067 }
    },
    "derivedExteriorPlacement": {
      "derivation": "OpenMW floor(position/4096) containment resolved against authored WastelandNV exterior CELL records",
      "cellFormId": "0x000E1AA7",
      "grid": [-18, -1],
      "serializedSaveFieldStatus": "unresolved; Save Global Data type 1 contains (-18,0) and is not being treated as the player transform cell"
    },
    "unresolvedFields": [
      "exteriorCellGrid",
      "cameraEyeOffset",
      "cameraFieldOfView",
      "cameraViewportCrop"
    ]
  },
  "camera": {
    "metadataStatus": "incomplete",
    "mode": "first-person",
    "unresolvedFields": [
      "position",
      "headingDegrees",
      "fieldOfViewDegrees",
      "viewportCropNormalized"
    ]
  },
  "scene": {
    "metadataStatus": "incomplete",
    "gameTimeHours": 14.215002059936523,
    "weatherFormId": "0x001237D7",
    "weatherEditorId": "NVWastelandGS",
    "saveRanges": {
      "skyPayload": {
        "offset": 494355,
        "bytes": 71,
        "sha256": "8492cf418cdf6f301a51d504b6a0b0df842282e77bae5607245d3fee04a71468"
      },
      "currentWeatherRefId": {
        "offset": 494355,
        "bytes": 3,
        "encoded": "0x004F59",
        "formIdArrayOneBasedIndex": 20313,
        "formIdArrayEntryOffset": 3389539
      },
      "gameTimeHours": {
        "offset": 494371,
        "bytes": 4,
        "encodedLittleEndian": "A6706341"
      }
    },
    "definitionEvidence": [
      {
        "path": "D:/code/nikami-worlds/external/xedit/Core/wbDefinitionsFNVSaves.pas",
        "sha256": "701f4b734b4c3bb28b32c6f8d1595b952e536bd7f75358d764eea6bec51db406"
      },
      {
        "path": "D:/code/nikami-worlds/external/jip-ln-nvse/nvse/GameData.h",
        "sha256": "d78f150ea33e4bab8e76500cb5e1262baed3a17981b222d8fb313b83fba914c8"
      }
    ],
    "unresolvedFields": [
      "visibleAuthoredReferences"
    ]
  },
  "candidatePolicy": {
    "eligibleNow": false,
    "reason": "The fixed pixels, first-person perspective, Save330 time, weather, player transform, and derived authored exterior placement are proven. Exact screenshot-bound camera/FOV/crop and complete visible authored references remain unresolved and fail closed.",
    "requiredCompletion": "Set both metadataStatus fields to complete only with hash-accounted retail evidence, populate every unresolved field, and regenerate any OpenMW capture manifest that references this manifest hash."
  }
}
